objectid,title,title_orig,creator,translator,date,introduction,description,subject,period,genre,region,language,orig_text,trans_text,endnotes,latitude,longitude,source,identifier,type,format,rights,rightsstatement,display_template,object_location,image_small,image_thumb
gmeml0008,"Complete Collection of the Laws of the Russian Empire, volume 3, article 1329",,Russian Empire,"Griffin Creech, University of Pennsylvania",,,,treaty; diplomatic history; legal history,,History,Siberia,Russian,"Бога вседержателя, в троице пресвятей славимаго, милостию великих государей царей и великих князей Иоанна Алексеевича, Петра Алексеевича, царей царем, обладателей стран, государств покорителей, самодержцев от Востока и до Запада, владетелей Севера и Юга, императорей принадлежащих, имеющих к ним государьств московских, киевских, владимерских, новогородцких, казанских, астраханских, сибирских, псковских, смоленских, тверских, югорских, пермских, вятцких, балгорских и иных государствей, и великих князей Новагорода низовские земли, черниговских, резанских, ростовских, ярославских, белоозерских, удорских, обдорских, кондинских, и государей Иверские земли карталинских и грузинских царей, и Кабардинские земли черкаских и горских князей, и иных многих государьств под власть свою и превысокую руку покорителей и победителей, крепчащих самодержцев, дарующих просящим мир и тишину, и на облегчение и на лутчее состояние вещей мирных управителей, християнских монархов, украшенных всякую милостию, высочайшаго царей царя бога, и их царского величества великие и полномочные послы, окольничей и наместник брянской Федор Алексеевич Головин с товарыщи учинил договор и постановление вечно нерушинные с мунгальским Ирки-кантазием и иными тайшами, которые писаны имяна ниже сего и которые по них над теми мунгальскими улусными людьми владетели будут.
Сего настоящего 7197-го году ноября 10 дня присылали они, тайши, великих государей, их царского величества, к великим и полномочным послом, к окольничему и наместнику брянскому Федору Алексеевичю Головину с товарыщи посланцов своих Уй-зайсана, с которыми в листу своем писал, чтоб великие государи, их царского величества, пожаловал, указали б их принять под свою царского величества высокосамодержавную руку со всеми при нем будущими улусными людьми. А они, тайши, служить им, царскому величеству, обещаются верно безо всякие измены. А чтоб кочевать им, тайшим, и с улусными своими людьми близ городов их царского величества Селенгинска по обе стороны реки Селенги, и никаких бы им, тайшам, и улусным их людем от подданных их царского величества каких-либо ни есть народов обид не было.
И по указу великих государей, их царского величества, великие и полномочные послы, окольничей и наместник брянской Федор Алексеевич Головин с товарыщи по тому ево, Ирки-кантазия, и иных тайшей прошению под самодержавную их царского величества высокую руку в вечное подданство со всеми ево зайсаны и улусными людьми на сих нижеимянованных статьях приняли.","[Lengthy title of the tsar, Peter the Great] and his royal highness’s royal plenipotentiary ambassadors, the okol’nichei [boyar rank] and vicar of Bryansk Fedor Alekseevich Golovin along with his associates made a perpetual, unbreakable contract and resolution with the Mongol Irki Kantazi and other taishas, who are indicated by name below in the present document and who will be the rulers of the various people of the Mongol ulus. In this year of 7197 on the tenth day of November they, the taishas, sent to his royal highness and to the great plenipotentiary ambassador, the okol’nichei [boyar rank] and vicar of Bryansk Fedor Alekseevich Golovin along with his associates, emissaries of the Ui zaisan, with whom there was a scroll on which had been written and requested that his royal highness might take them under his own royal autocratic hand along with all of the present and future people of the ulus. And they, the taishas, serving his royal highness, promise to do so eternally, without any treachery [izmeny] whatsoever. And [they promise] that they, the taishas, along with the people of their ulus, will nomadize near to the cities of his royal highness of Selenginsk, on both sides of the Selenge River, and that they, the taishas, and their people in the ulus had no grievance against being subjects of his royal highness.
And according to an order of his royal highness, and the great plenipotentiary ambassador, the okol’nichei [boyar rank] and vicar of Bryansk Fedor Alekseevich Golovin along with his associates, Irki Kantaziia and other taishas agreed to the articles named below by means of a petition to come under the almighty, autocratic hand of his royal highness in the form of eternal subjecthood along with all of his zaisans and the people of the ulus.",,,,,,,,,,item,,,
gmeml0009,"Siberian Ordinances, no. 1059, pts. 2-3",,Ambassador F.A. Golovina,"Griffin Creech, University of Pennsylvania",,,,diplomatic history; Steppe history; Siberia; Mongols,,Diplomatic Correspondence,Siberia,Russian,"В нынешнем, государи, во 198 году декабря в 29 день писал к нам, холопям вашим, из Селенгинска жилец Федор Ушаков, а в отписке ево написано. — По ведомости новых выходцов мунгальских людей подданой вашего царского величества Ирки-кантазия-тайша, презрев к себе вашу великих государей премногую милость и забыв шерть свою и обещание, ис-под самодержавные вашие царского величества высокие руки, с улусными своими людьми собрався, бежал в Мунгальскую землю. И по тем де ведомостям посылал он, Федор, из Селенгинска сына боярского Демьяна Многогрешного 1 с служилыми людьми за вышеписанным тайшею. И он де, Демьян, ис той посылки в Селенгинск приехал, а сказал, что де он, Демьян, с служилыми людьми в погоню за Ирки-контазием ездил до Караульного камени и выше по реке Селенге, где стоял он, Ирки-кантазия, с улусными своими людьми, и ево, Ирки-кантазия, и улусных ево людей никого не застал. И он де, Демьян, за малолюдством за тем тайшею вдаль ехать не посмел. А после побегу ево, Ирки-кантазия-тайши, того ж числа пришли в Селенгинской Ирки-кантазиевых улусов Уйцышки-зайсан, да Гичюл-зайсан, да зять ево, Ирки-кантазиев, Дайбун, всего в пятидесят юртах, и били челом вам, великим государем, а ему, Федору, говорили словесно, чтоб вы, великие государи, пожаловали, велели их принять /л. 12/ в ясачной платеж к Селенгинску, а они, зайсаны, и с улусными своими людьми служить вам, великим государем, будут безотступно.","At the present moment, your majesty, on December 29, 1689, Fedor Ushakov, your servant and tenant in Selenginsk, wrote to you and in his report it was written that – according to the statements of new immigrants, Mongol subject peoples of your royal highness Irki Kantaziia taisha, disdaining your majesty’s infinite grace and forgetting his promise, gathered and fled into Mongolian territory along with those living in his ulus out from under your royal highness’s mighty autocratic hand. And based on this news, Fedor sent the son of a boyar Dem’ian Mnogogreshnii from Selenginsk with soldiers to the above-written taisha. And on this mission Dem’ian came to Selenginsk and said that he and the soldiers with him went up to the stones marking the border [do Karaul’nogo kameni] and further up along the Selenge river, where Irki Kantaziia stood with the people of his ulus, and they did not catch either Irki Kantaziia or any of those in his ulus. Dem’ian, because of the lack of people [in that place] did not dare go further into the distance. On this same day after the flight of Irki Kantaziia taisha’s Uitsyshki zaisan, Gichiul zaisan, his son-in-law, Irki Kantaziev, Daibun, fifty yurts altogether, and asked you, mighty ruler, and him, Fedor, out loud if you, mighty ruler, might take them, the zaisans and those in their ulus, into the system of iasak payments in Selenginsk [Russian city at the time] where will serve you relentlessly.",,,,,,,,,,item,,,
gmeml0010,Parable of One Who Praised His Father’s Virtuous Deeds,,Bai Yu Jing,"Vito Acosta, University of Pennsylvania",,,,Buddhist; tales,,Parable,China,Middle Vernacular Sinitic,叹父德行喻 昔时有人 ，于众人中叹己父德 ，而作是言 :“我父仁慈 ，不害不盗 ，直作实语 ，兼行布施 。” 时有愚人，闻其此语，便作是念 ，言:“我父德行，复过汝父。”诸人问言: “有何德行 ，请道其事。”愚人答曰 :“我父小来，断绝淫欲，初无染污。”众人语言 :“若断淫欲，云何生汝?” 深为时人之所怪笑。 犹如世间无智之徒，欲赞人德，不识其实，反致毁呰。如彼愚者，意好 叹父，言成过失 ，此亦如是。,"Parable of One Who Praised His Father’s Virtuous Deeds
In former times there was a man who [would] praise his father’s virtues in public, and said this (speech) /made the following declaration: « My father is benevolent; he neither injures nor steals; he without fail tells the truth; and (兼 = without distinction, impartially double) moreover contributes to charity work. »
At the time, a foolish man, hearing that he spoke thus, then had the idea to say: « My father’s virtuous deeds exceed those of your father. »
The others asked: « What of his benevolence? Please tell of his deeds. »
The foolish man answered: « When [Ever since] my father was young, he severed his licentious desires and from the start never defiled himself [in sex]. » The crowd said: « If he had severed [all his] sexual desires, then how were you born? » This became the joke of the day. It is as if those of this world who lack wisdom and wish to exalt a man’s wisdom without knowing his affairs on the contrary end up in ruin/slander. Just as this fool, who wanted to praise his father, spoke in error and it was thus.",,,,,,,,,,item,,,
gmeml0011,Parable of A Foolish Man Who Ate Salt,,Bai Yu Jing,"Vito Acosta, University of Pennsylvania",,,,Buddhist; tales,,Parable,China,Middle Vernacular Sinitic,愚人食盐喻 昔有愚人，至于他家，主人与食，嫌淡无味。主人闻已，更为益盐。 既得盐美 ，便自念言 :“所以美者 ，缘有盐故 。 少有尚尔 ，况复多也?” 愚人无智，便空食盐。食已口爽，返为其患。譬彼外道1 ，闻节饮食可以得道，即便断食。或经七日，或十五日，徒自困饿，无益于道。如彼愚人 ，以盐美故 ，而空食之 ，至令口爽 ，此亦复尔 。,"Parable of A Foolish Man Who Ate Salt
In former times there was a foolish man who arrived at someone’s house. The host invited him for dinner, but he disliked the food, finding it bland and tasteless. The host listened and added salt. As he was pleased with the salt, he said to himself: « It is the salt that makes it good. If it is like this with little, how much better would it be with even more? » The foolish man lacked sense and began to fill up on salt. He ate it up until his mouth became numb, making him miserable. This is like those outside the Way, who hearing that abstinence/fasting can help one obtain the Way, thereafter abstains from eating (and drinking?). Some last seven days, some fifteen, suffering from hunger in vain, all without reaching the Way. Like the foolish man who thought salt good and ate it by itself until his mouth was numb, it shall be thus.",,,,,,,,,,item,,,